<?xml version="1.0" encoding="ISO-8859-1" standalone="no"?>
<!-- <!DOCTYPE database SYSTEM 
"http://jakarta.apache.org/turbine/dtd/database.dtd"> -->

<!-- ==================================================================== -->
<!--                                                                      -->
<!-- I D  B R O K E R  S C H E M A                                        -->
<!--                                                                      -->
<!-- ==================================================================== -->
<!-- This is the XML schema use by Torque to generate the SQL for         -->
<!-- ID_TABLE table used by the id broker mechanism in Turbine.           -->
<!-- ==================================================================== -->
<!-- @author: <a href="mailto:jvanzyl@periapt.com">Jason van Zyl</a>      -->
<!-- @version $Id: id-table-schema.xml,v 1.1 2001/12/30 16:07:38 jmcnally Exp $ -->
<!-- ==================================================================== -->

<database name="@DATABASE_NAME@">
  <table name="ID_TABLE" idMethod="idBroker">
    <column name="ID_TABLE_ID" required="true" primaryKey="true" type="INTEGER"/>
    <column name="TABLE_NAME" required="true" size="255" type="VARCHAR"/>
    <column name="NEXT_ID" type="INTEGER"/>
    <column name="QUANTITY" type="INTEGER"/>
    
    <unique>
      <unique-column name="TABLE_NAME"/>
    </unique>        
    
  </table>
</database>  
